Symbol	Description	Issuer
IVV	iShares Core S&P 500 ETF	iShares
IEFA	iShares Core MSCI EAFE ETF	iShares
AGG	iShares Core U.S. Aggregate Bond ETF	iShares
IWF	iShares Russell 1000 Growth ETF	iShares
IJH	iShares Core S&P Mid-Cap ETF	iShares
IEMG	iShares Core MSCI Emerging Markets ETF	iShares
IJR	iShares Core S&P Small-Cap ETF	iShares
IWM	iShares Russell 2000 ETF	iShares
ITOT	iShares Core S&P Total U.S. Stock Market ETF	iShares
IWD	iShares Russell 1000 Value ETF	iShares
EFA	iShares MSCI EAFE ETF	iShares
IVW	iShares S&P 500 Growth ETF	iShares
TLT	iShares 20+ Year Treasury Bond ETF	iShares
IBIT	iShares Bitcoin Trust ETF	iShares
QUAL	iShares MSCI USA Quality Factor ETF	iShares
IAU	iShares Gold Trust	iShares
IXUS	iShares Core MSCI Total International Stock ETF	iShares
MUB	iShares National Muni Bond ETF	iShares
SGOV	iShares 0-3 Month Treasury Bond ETF	iShares
IWR	iShares Russell Mid-Cap ETF	iShares
IWB	iShares Russell 1000 ETF	iShares
IVE	iShares S&P 500 Value ETF	iShares
MBB	iShares MBS ETF	iShares
IEF	iShares 7-10 Year Treasury Bond ETF	iShares
IUSB	iShares Core Total USD Bond Market ETF	iShares
DGRO	iShares Core Dividend Growth ETF	iShares
LQD	iShares iBoxx $ Investment Grade Corporate Bond ETF	iShares
GOVT	iShares U.S. Treasury Bond ETF	iShares
USMV	iShares MSCI USA Min Vol Factor ETF	iShares
SHY	iShares 1-3 Year Treasury Bond ETF	iShares
IGSB	iShares 1-5 Year Investment Grade Corporate Bond ETF	iShares
EFV	iShares MSCI EAFE Value ETF	iShares
IUSV	iShares Core S&P U.S. Value ETF	iShares
USHY	iShares Broad USD High Yield Corporate Bond ETF	iShares
SHV	iShares Short Treasury Bond ETF	iShares
IUSG	iShares Core S&P U.S. Growth ETF	iShares
DVY	iShares Select Dividend ETF	iShares
ACWI	iShares MSCI ACWI ETF	iShares
IDEV	iShares Core MSCI International Developed Markets ETF	iShares
IYW	iShares U.S. Technology ETF	iShares
IWP	iShares Russell Mid-Cap Growth ETF	iShares
EEM	iShares MSCI Emerging Markets ETF	iShares
OEF	iShares S&P 100 ETF	iShares
HYG	iShares iBoxx $ High Yield Corporate Bond ETF	iShares
DYNF	iShares U.S. Equity Factor Rotation Active ETF	iShares
IEI	iShares 3-7 Year Treasury Bond ETF	iShares
IGIB	iShares 5-10 Year Investment Grade Corporate Bond ETF	iShares
SLV	iShares Silver Trust	iShares
EMXC	iShares MSCI Emerging Markets ex China ETF	iShares
IWV	iShares Russell 3000 ETF	iShares
TIP	iShares TIPS Bond ETF	iShares
PFF	iShares Preferred and Income Securities ETF	iShares
MTUM	iShares MSCI USA Momentum Factor ETF	iShares
EMB	iShares J.P. Morgan USD Emerging Markets Bond ETF	iShares
EWJ	iShares MSCI Japan ETF	iShares
IWS	iShares Russell Mid-Cap Value ETF	iShares
ESGU	iShares ESG Aware MSCI USA ETF	iShares
USIG	iShares Broad USD Investment Grade Corporate Bond ETF	iShares
EFG	iShares MSCI EAFE Growth ETF	iShares
IWY	iShares Russell Top 200 Growth ETF	iShares
STIP	iShares 0-5 Year TIPS Bond ETF	iShares
SOXX	iShares Semiconductor ETF	iShares
HDV	iShares Core High Dividend ETF	iShares
IWN	iShares Russell 2000 Value ETF	iShares
IWO	iShares Russell 2000 Growth ETF	iShares
IGV	iShares Expanded Tech-Software Sector ETF	iShares
TLH	iShares 10-20 Year Treasury Bond ETF	iShares
SCZ	iShares MSCI EAFE Small-Cap ETF	iShares
ESGD	iShares ESG Aware MSCI EAFE ETF	iShares
FLOT	iShares Floating Rate Bond ETF	iShares
IQLT	iShares MSCI Intl Quality Factor ETF	iShares
EZU	iShares MSCI Eurozone ETF	iShares
SUB	iShares Short-Term National Muni Bond ETF	iShares
INDA	iShares MSCI India ETF	iShares
IJK	iShares S&P Mid-Cap 400 Growth ETF	iShares
BINC	iShares Flexible Income Active ETF	iShares
IJJ	iShares S&P Mid-Cap 400 Value ETF	iShares
HEFA	iShares Currency Hedged MSCI EAFE ETF	iShares
FXI	iShares China Large-Cap ETF	iShares
IAGG	iShares Core International Aggregate Bond ETF	iShares
VLUE	iShares MSCI USA Value Factor ETF	iShares
TFLO	iShares Treasury Floating Rate Bond ETF	iShares
IJS	iShares S&P Small-Cap 600 Value ETF	iShares
ITA	iShares U.S. Aerospace & Defense ETF	iShares
SHYG	iShares 0-5 Year High Yield Corporate Bond ETF	iShares
MCHI	iShares MSCI China ETF	iShares
IOO	iShares Global 100 ETF	iShares
IGF	iShares Global Infrastructure ETF	iShares
IBB	iShares Biotechnology ETF	iShares
IJT	iShares S&P Small-Cap 600 Growth ETF	iShares
ACWX	iShares MSCI ACWI ex U.S. ETF	iShares
ICSH	iShares Ultra Short-Term Bond Active ETF	iShares
IGM	iShares Expanded Tech Sector ETF	iShares
IEUR	iShares Core MSCI Europe ETF	iShares
EFAV	iShares MSCI EAFE Min Vol Factor ETF	iShares
IXN	iShares Global Tech ETF	iShares
IHI	iShares U.S. Medical Devices ETF	iShares
EWT	iShares MSCI Taiwan ETF	iShares
ESGE	iShares ESG Aware MSCI EM ETF	iShares
IDV	iShares International Select Dividend ETF	iShares
DSI	iShares ESG MSCI KLD 400 ETF	iShares
URTH	iShares MSCI World ETF	iShares
ISTB	iShares Core 1-5 Year USD Bond ETF	iShares
EEMV	iShares MSCI Emerging Markets Min Vol Factor ETF	iShares
IXJ	iShares Global Healthcare ETF	iShares
CMF	iShares California Muni Bond ETF	iShares
REET	iShares Global REIT ETF	iShares
EAGG	iShares ESG Aware U.S. Aggregate Bond ETF	iShares
IYF	iShares U.S. Financials ETF	iShares
IYR	iShares U.S. Real Estate ETF	iShares
SUSA	iShares MSCI USA ESG Select ETF	iShares
ACWV	iShares MSCI Global Min Vol Factor ETF	iShares
EWZ	iShares MSCI Brazil ETF	iShares
GVI	iShares Intermediate Government/Credit Bond ETF	iShares
IBDR	iShares® iBonds® Dec 2026 Term Corporate ETF	iShares
EWU	iShares MSCI United Kingdom ETF	iShares
NEAR	iShares Short Duration Bond Active ETF	iShares
IYH	iShares U.S. Healthcare ETF	iShares
IBDQ	iShares® iBonds® Dec 2025 Term Corporate ETF	iShares
IWX	iShares Russell Top 200 Value ETF	iShares
EWY	iShares MSCI South Korea ETF	iShares
XT	iShares Exponential Technologies ETF	iShares
EUFN	iShares MSCI Europe Financials ETF	iShares
IBDS	iShares® iBonds® Dec 2027 Term Corporate ETF	iShares
USRT	iShares Core U.S. REIT ETF	iShares
IBDT	iShares® iBonds® Dec 2028 Term Corporate ETF	iShares
IGLB	iShares 10+ Year Investment Grade Corporate Bond ETF	iShares
ICVT	iShares Convertible Bond ETF	iShares
EWC	iShares MSCI Canada ETF	iShares
IMCG	iShares Morningstar Mid-Cap Growth ETF	iShares
AAXJ	iShares MSCI All Country Asia ex Japan ETF	iShares
IBDU	iShares® iBonds® Dec 2029 Term Corporate ETF	iShares
IMTM	iShares MSCI Intl Momentum Factor ETF	iShares
ITB	iShares U.S. Home Construction ETF	iShares
ETHA	iShares Ethereum Trust ETF	iShares
LRGF	iShares U.S. Equity Factor ETF	iShares
ILCG	iShares Morningstar Growth ETF	iShares
AOR	iShares Core 60/40 Balanced Allocation ETF	iShares
SLQD	iShares 0-5 Year Investment Grade Corporate Bond ETF	iShares
IBTF	iShares® iBonds® Dec 2025 Term Treasury ETF	iShares
IYY	iShares Dow Jones U.S. ETF	iShares
IFRA	iShares U.S. Infrastructure ETF	iShares
USCL	iShares Climate Conscious & Transition MSCI USA ETF	iShares
AOA	iShares Core 80/20 Aggressive Allocation ETF	iShares
FALN	iShares Fallen Angels USD Bond ETF	iShares
IPAC	iShares Core MSCI Pacific ETF	iShares
EWG	iShares MSCI Germany ETF	iShares
PABU	iShares Paris-Aligned Climate MSCI USA ETF	iShares
IAUM	iShares Gold Trust Micro	iShares
IVLU	iShares MSCI Intl Value Factor ETF	iShares
ICF	iShares Cohen & Steers REIT ETF	iShares
IEV	iShares Europe ETF	iShares
EPP	iShares MSCI Pacific ex Japan ETF	iShares
HIMU	iShares High Yield Muni Active ETF	iShares
IXC	iShares Global Energy ETF	iShares
IBTG	iShares® iBonds® Dec 2026 Term Treasury ETF	iShares
ESML	iShares ESG Aware MSCI USA Small-Cap ETF	iShares
SMLF	iShares U.S. Small-Cap Equity Factor ETF	iShares
IBDV	iShares® iBonds® Dec 2030 Term Corporate ETF	iShares
IYG	iShares U.S. Financial Services ETF	iShares
HYDB	iShares High Yield Systematic Bond ETF	iShares
IYJ	iShares U.S. Industrials ETF	iShares
IWL	iShares Russell Top 200 ETF	iShares
QLTA	iShares Aaa - A Rated Corporate Bond ETF	iShares
IBTH	iShares® iBonds® Dec 2027 Term Treasury ETF	iShares
EWW	iShares MSCI Mexico ETF	iShares
IYK	iShares U.S. Consumer Staples ETF	iShares
AOM	iShares Core 40/60 Moderate Allocation ETF	iShares
IBDW	iShares® iBonds® Dec 2031 Term Corporate ETF	iShares
IAI	iShares U.S. Broker-Dealers & Securities Exchanges ETF	iShares
EWA	iShares MSCI Australia ETF	iShares
INTF	iShares International Equity Factor ETF	iShares
IYC	iShares U.S. Consumer Discretionary ETF	iShares
IDU	iShares U.S. Utilities ETF	iShares
ILF	iShares Latin America 40 ETF	iShares
SMMD	iShares Russell 2500 ETF	iShares
IYE	iShares U.S. Energy ETF	iShares
ICLN	iShares Global Clean Energy ETF	iShares
USXF	iShares ESG Advanced MSCI USA ETF	iShares
RING	iShares MSCI Global Gold Miners ETF	iShares
EUSA	iShares MSCI USA Equal Weighted ETF	iShares
LCTU	BlackRock U.S. Carbon Transition Readiness ETF	iShares
EWL	iShares MSCI Switzerland ETF	iShares
TLTW	iShares 20+ Year Treasury Bond BuyWrite Strategy ETF	iShares
SUSC	iShares ESG Aware USD Corporate Bond ETF	iShares
IGEB	iShares Investment Grade Systematic Bond ETF	iShares
GSG	iShares S&P GSCI Commodity-Indexed Trust	iShares
IBDX	iShares® iBonds® Dec 2032 Term Corporate ETF	iShares
IGRO	iShares International Dividend Growth ETF	iShares
IMCB	iShares Morningstar Mid-Cap ETF	iShares
ILCV	iShares Morningstar Value ETF	iShares
IBTI	iShares® iBonds® Dec 2028 Term Treasury ETF	iShares
SUSB	iShares ESG Aware 1-5 Year USD Corporate Bond ETF	iShares
ILCB	iShares Morningstar U.S. Equity ETF	iShares
CRBN	iShares MSCI ACWI Low Carbon Target ETF	iShares
EXI	iShares Global Industrials ETF	iShares
IHAK	iShares Cybersecurity and Tech ETF	iShares
SUSL	iShares ESG MSCI USA Leaders ETF	iShares
EWP	iShares MSCI Spain ETF	iShares
NYF	iShares New York Muni Bond ETF	iShares
REZ	iShares Residential and Multisector Real Estate ETF	iShares
IWC	iShares Micro-Cap ETF	iShares
MEAR	iShares Short Maturity Municipal Bond Active ETF	iShares
ARTY	iShares Future AI & Tech ETF	iShares
IBHF	iShares® iBonds® 2026 Term High Yield and Income ETF	iShares
EWS	iShares MSCI Singapore ETF	iShares
IAK	iShares U.S. Insurance ETF	iShares
EMGF	iShares Emerging Markets Equity Factor ETF	iShares
CLOA	iShares AAA CLO Active ETF	iShares
SMIN	iShares MSCI India Small-Cap ETF	iShares
PICK	iShares MSCI Global Metals & Mining Producers ETF	iShares
DMXF	iShares ESG Advanced MSCI EAFE ETF	iShares
AIA	iShares Asia 50 ETF	iShares
DVYE	iShares Emerging Markets Dividend ETF	iShares
IAT	iShares U.S. Regional Banks ETF	iShares
HEZU	iShares Currency Hedged MSCI Eurozone ETF	iShares
BIDD	iShares International Dividend Active ETF	iShares
IBDY	iShares® iBonds® Dec 2033 Term Corporate ETF	iShares
IHF	iShares U.S. Healthcare Providers ETF	iShares
KXI	iShares Global Consumer Staples ETF	iShares
DIVB	iShares Core Dividend ETF	iShares
EUSB	iShares ESG Advanced Total USD Bond Market ETF	iShares
KSA	iShares MSCI Saudi Arabia ETF	iShares
COMT	iShares GSCI Commodity Dynamic Roll Strategy ETF	iShares
ISCG	iShares Morningstar Small-Cap Growth ETF	iShares
REM	iShares Mortgage Real Estate ETF	iShares
IGE	iShares North American Natural Resources ETF	iShares
INDY	iShares India 50 ETF	iShares
AGZ	iShares Agency Bond ETF	iShares
EWH	iShares MSCI Hong Kong ETF	iShares
IMCV	iShares Morningstar Mid-Cap Value ETF	iShares
IBTJ	iShares® iBonds® Dec 2029 Term Treasury ETF	iShares
AOK	iShares Core 30/70 Conservative Allocation ETF	iShares
ILTB	iShares Core 10+ Year USD Bond ETF	iShares
IBHE	iShares® iBonds® 2025 Term High Yield and Income ETF	iShares
IHE	iShares U.S. Pharmaceuticals ETF	iShares
IYT	iShares U.S. Transportation ETF	iShares
ECH	iShares MSCI Chile ETF	iShares
IEO	iShares U.S. Oil & Gas Exploration & Production ETF	iShares
LQDH	iShares Interest Rate Hedged Corporate Bond ETF	iShares
THRO	iShares U.S. Thematic Rotation Active ETF	iShares
IBMP	iShares® iBonds® Dec 2027 Term Muni Bond ETF	iShares
IYM	iShares U.S. Basic Materials ETF	iShares
IBMO	iShares® iBonds® Dec 2026 Term Muni Bond ETF	iShares
EWQ	iShares MSCI France ETF	iShares
IXG	iShares Global Financials ETF	iShares
IBMN	iShares® iBonds® Dec 2025 Term Muni Bond ETF	iShares
EMHY	iShares J.P. Morgan EM High Yield Bond ETF	iShares
HYGH	iShares Interest Rate Hedged High Yield Bond ETF	iShares
IETC	iShares U.S. Tech Independence Focused ETF	iShares
CMBS	iShares CMBS ETF	iShares
IGOV	iShares International Treasury Bond ETF	iShares
ISCV	iShares Morningstar Small-Cap Value ETF	iShares
IBMQ	iShares® iBonds® Dec 2028 Term Muni Bond ETF	iShares
IYZ	iShares U.S. Telecommunications ETF	iShares
EWI	iShares MSCI Italy ETF	iShares
BGRN	iShares USD Green Bond ETF	iShares
TECB	iShares U.S. Tech Breakthrough Multisector ETF	iShares
EEMA	iShares MSCI Emerging Markets Asia ETF	iShares
HYBB	iShares BB Rated Corporate Bond ETF	iShares
CEMB	iShares J.P. Morgan EM Corporate Bond ETF	iShares
IBTK	iShares® iBonds® Dec 2030 Term Treasury ETF	iShares
EWD	iShares MSCI Sweden ETF	iShares
HEWJ	iShares Currency Hedged MSCI Japan ETF	iShares
EZA	iShares MSCI South Africa ETF	iShares
GNMA	iShares GNMA Bond ETF	iShares
IXP	iShares Global Comm Services ETF	iShares
IBTL	iShares® iBonds® Dec 2031 Term Treasury ETF	iShares
IBTO	iShares® iBonds® Dec 2033 Term Treasury ETF	iShares
EPOL	iShares MSCI Poland ETF	iShares
GARP	iShares MSCI USA Quality GARP ETF	iShares
ISCF	iShares International Small-Cap Equity Factor ETF	iShares
EWJV	iShares MSCI Japan Value ETF	iShares
SHYM	iShares High Yield Muni Income Active ETF	iShares
EEMS	iShares MSCI Emerging Markets Small-Cap ETF	iShares
IBTM	iShares® iBonds® Dec 2032 Term Treasury ETF	iShares
SIZE	iShares MSCI USA Size Factor ETF	iShares
LEMB	iShares J.P. Morgan EM Local Currency Bond ETF	iShares
XVV	iShares ESG Select Screened S&P 500 ETF	iShares
CMDY	iShares Bloomberg Roll Select Commodity Strategy ETF	iShares
IBDZ	iShares® iBonds® Dec 2034 Term Corporate ETF	iShares
SMMV	iShares MSCI USA Small-Cap Min Vol Factor ETF	iShares
GOVZ	iShares 25+ Year Treasury STRIPS Bond ETF	iShares
EIDO	iShares MSCI Indonesia ETF	iShares
IBHG	iShares® iBonds® 2027 Term High Yield and Income ETF	iShares
EWM	iShares MSCI Malaysia ETF	iShares
RXI	iShares Global Consumer Discretionary ETF	iShares
XJH	iShares ESG Select Screened S&P Mid-Cap ETF	iShares
SLVP	iShares MSCI Global Silver and Metals Miners ETF	iShares
HAWX	iShares Currency Hedged MSCI ACWI ex U.S. ETF	iShares
BALI	iShares Advantage Large Cap Income ETF	iShares
EWN	iShares MSCI Netherlands ETF	iShares
BYLD	iShares Yield Optimized Bond ETF	iShares
EIS	iShares MSCI Israel ETF	iShares
IVVB	iShares Large Cap Deep Buffer ETF	iShares
WOOD	iShares Global Timber & Forestry ETF	iShares
MXI	iShares Global Materials ETF	iShares
IMTB	iShares Core 5-10 Year USD Bond ETF	iShares
LQDW	iShares Investment Grade Corporate Bond BuyWrite Strategy ETF	iShares
HYGW	iShares High Yield Corporate Bond BuyWrite Strategy ETF	iShares
CNYA	iShares MSCI China A ETF	iShares
IBMR	iShares® iBonds® Dec 2029 Term Muni Bond ETF	iShares
LCTD	BlackRock World ex U.S. Carbon Transition Readiness ETF	iShares
ISCB	iShares Morningstar Small-Cap ETF	iShares
EDEN	iShares MSCI Denmark ETF	iShares
IBHH	iShares® iBonds® 2028 Term High Yield and Income ETF	iShares
TOK	iShares MSCI Kokusai ETF	iShares
BRTR	iShares Total Return Active ETF	iShares
TUR	iShares MSCI Turkey ETF	iShares
HYXF	iShares ESG Advanced High Yield Corporate Bond ETF	iShares
THD	iShares MSCI Thailand ETF	iShares
AQLT	iShares MSCI Global Quality Factor ETF	iShares
SDG	iShares MSCI Global Sustainable Development Goals ETF	iShares
TOPT	iShares Top 20 U.S. Stocks ETF	iShares
HEEM	iShares Currency Hedged MSCI Emerging Markets ETF	iShares
HSCZ	iShares Currency Hedged MSCI EAFE Small-Cap ETF	iShares
GHYG	iShares US & Intl High Yield Corp Bond ETF	iShares
JXI	iShares Global Utilities ETF	iShares
IDRV	iShares Self-Driving EV and Tech ETF	iShares
IEZ	iShares U.S. Oil Equipment & Services ETF	iShares
GBF	iShares Government/Credit Bond ETF	iShares
PMMF	iShares Prime Money Market ETF	iShares
IBHI	iShares® iBonds® 2029 Term High Yield and Income ETF	iShares
EPU	iShares MSCI Peru and Global Exposure ETF	iShares
SVAL	iShares US Small Cap Value Factor ETF	iShares
SMAX	iShares Large Cap Max Buffer Sep ETF	iShares
EWZS	iShares MSCI Brazil Small-Cap ETF	iShares
IDGT	iShares U.S. Digital Infrastructure and Real Estate ETF	iShares
MAXJ	iShares Large Cap Max Buffer Jun ETF	iShares
IYLD	iShares Morningstar Multi-Asset Income ETF	iShares
SCJ	iShares MSCI Japan Small-Cap ETF	iShares
IDNA	iShares Genomics Immunology and Healthcare ETF	iShares
UAE	iShares MSCI UAE ETF	iShares
IBTP	iShares® iBonds® Dec 2034 Term Treasury ETF	iShares
IGBH	iShares Interest Rate Hedged Long-Term Corporate Bond ETF	iShares
GLOF	iShares Global Equity Factor ETF	iShares
BAI	iShares A.I. Innovation and Tech Active ETF	iShares
IEUS	iShares MSCI Europe Small-Cap ETF	iShares
BRHY	iShares High Yield Active ETF	iShares
PABD	iShares Paris-Aligned Climate MSCI World ex USA ETF	iShares
VEGI	iShares MSCI Agriculture Producers ETF	iShares
QTOP	iShares Nasdaq Top 30 Stocks ETF	iShares
CSHP	iShares Enhanced Short-Term Bond Active ETF	iShares
XJR	iShares ESG Select Screened S&P Small-Cap ETF	iShares
EPHE	iShares MSCI Philippines ETF	iShares
LQDI	iShares Inflation Hedged Corporate Bond ETF	iShares
IFGL	iShares International Developed Real Estate ETF	iShares
JPXN	iShares JPX-Nikkei 400 ETF	iShares
FILL	iShares MSCI Global Energy Producers ETF	iShares
EMXF	iShares ESG Advanced MSCI EM ETF	iShares
ISHG	iShares 1-3 Year International Treasury Bond ETF	iShares
KWT	iShares MSCI Kuwait ETF	iShares
BKF	iShares MSCI BIC ETF	iShares
IVVM	iShares Large Cap Moderate Buffer ETF	iShares
EWO	iShares MSCI Austria ETF	iShares
DMAX	iShares Large Cap Max Buffer Dec ETF	iShares
QAT	iShares MSCI Qatar ETF	iShares
ENZL	iShares MSCI New Zealand ETF	iShares
FIBR	iShares U.S. Fixed Income Balanced Risk Systematic ETF	iShares
ECNS	iShares MSCI China Small-Cap ETF	iShares
BRLN	iShares Floating Rate Loan Active ETF	iShares
CALI	iShares Short-Term California Muni Active ETF	iShares
EIRL	iShares MSCI Ireland ETF	iShares
BCLO	iShares BBB-B CLO Active ETF	iShares
IBGA	iShares® iBonds® Dec 2044 Term Treasury ETF	iShares
IBHJ	iShares® iBonds® 2030 Term High Yield and Income ETF	iShares
INMU	iShares Intermediate Muni Income Active ETF	iShares
ICOP	iShares Copper and Metals Mining ETF	iShares
AGRH	iShares Interest Rate Hedged U.S. Aggregate Bond ETF	iShares
BEMB	iShares J.P. Morgan Broad USD Emerging Markets Bond ETF	iShares
IBMS	iShares® iBonds® Dec 2030 Term Muni Bond ETF	iShares
HYXU	iShares International High Yield Bond ETF	iShares
LQDB	iShares BBB Rated Corporate Bond ETF	iShares
CCRV	iShares Commodity Curve Carry Strategy ETF	iShares
IBIC	iShares® iBonds® Oct 2026 Term TIPS ETF	iShares
DVYA	iShares Asia/Pacific Dividend ETF	iShares
IVVW	iShares S&P 500 BuyWrite ETF	iShares
IBID	iShares® iBonds® Oct 2027 Term TIPS ETF	iShares
EWUS	iShares MSCI United Kingdom Small-Cap ETF	iShares
IBIK	iShares® iBonds® Oct 2034 Term TIPS ETF	iShares
IBIE	iShares® iBonds® Oct 2028 Term TIPS ETF	iShares
IBIF	iShares® iBonds® Oct 2029 Term TIPS ETF	iShares
GMMF	iShares Government Money Market ETF	iShares
ENOR	iShares MSCI Norway ETF	iShares
IBIB	iShares® iBonds® Oct 2025 Term TIPS ETF	iShares
IBLC	iShares Blockchain and Tech ETF	iShares
IEDI	iShares U.S. Consumer Focused ETF	iShares
EAOA	iShares ESG Aware 80/20 Aggressive Allocation ETF	iShares
ITDD	iShares® LifePath® Target Date 2040 ETF	iShares
IBIG	iShares® iBonds® Oct 2030 Term TIPS ETF	iShares
LDEM	iShares ESG MSCI EM Leaders ETF	iShares
ITDC	iShares® LifePath® Target Date 2035 ETF	iShares
ISVL	iShares International Developed Small Cap Value Factor ETF	iShares
IBIJ	iShares® iBonds® Oct 2033 Term TIPS ETF	iShares
BLCV	iShares Large Cap Value Active ETF	iShares
TCHI	iShares MSCI China Multisector Tech ETF	iShares
ITDE	iShares® LifePath® Target Date 2045 ETF	iShares
IBIH	iShares® iBonds® Oct 2031 Term TIPS ETF	iShares
ITDF	iShares® LifePath® Target Date 2050 ETF	iShares
IWMW	iShares Russell 2000 BuyWrite ETF	iShares
IBHK	iShares® iBonds® 2031 Term High Yield and Income ETF	iShares
INRO	iShares U.S. Industry Rotation Active ETF	iShares
EVUS	iShares ESG Aware MSCI USA Value ETF	iShares
EAOR	iShares ESG Aware 60/40 Balanced Allocation ETF	iShares
EGUS	iShares ESG Aware MSCI USA Growth ETF	iShares
LMUB	iShares Long-Term National Muni Bond ETF	iShares
FOVL	iShares Focused Value Factor ETF	iShares
ITDB	iShares® LifePath® Target Date 2030 ETF	iShares
EFNL	iShares MSCI Finland ETF	iShares
TEK	iShares Technology Opportunities Active ETF	iShares
IBII	iShares® iBonds® Oct 2032 Term TIPS ETF	iShares
LDRT	iShares® iBonds® 1-5 Year Treasury Ladder ETF	iShares
ISMF	iShares Managed Futures Active ETF	iShares
ITDG	iShares® LifePath® Target Date 2055 ETF	iShares
IRTR	iShares® LifePath® Retirement ETF	iShares
QNXT	iShares Nasdaq-100 ex Top 30 ETF	iShares
MADE	iShares U.S. Manufacturing ETF	iShares
TWOX	iShares Large Cap Accelerated ETF	iShares
ELQD	iShares ESG Advanced Investment Grade Corporate Bond ETF	iShares
EWK	iShares MSCI Belgium ETF	iShares
BELT	iShares Long-Term U.S. Equity Active ETF	iShares
IBHL	iShares® iBonds® 2032 Term High Yield and Income ETF	iShares
TMET	iShares Transition-Enabling Metals ETF	iShares
ITDH	iShares® LifePath® Target Date 2060 ETF	iShares
ERET	iShares Environmentally Aware Real Estate ETF	iShares
ITDI	iShares® LifePath® Target Date 2065 ETF	iShares
EMIF	iShares Emerging Markets Infrastructure ETF	iShares
ESMV	iShares ESG MSCI USA Min Vol Factor ETF	iShares
EAOK	iShares ESG Aware 30/70 Conservative Allocation ETF	iShares
EQLT	iShares MSCI Emerging Markets Quality Factor ETF	iShares
BLCR	iShares Large Cap Core Active ETF	iShares
EVLU	iShares MSCI Emerging Markets Value Factor ETF	iShares
IDAT	iShares Future Cloud 5G and Tech ETF	iShares
IBCA	iShares® iBonds® Dec 2035 Term Corporate ETF	iShares
IVRS	iShares Future Metaverse Tech and Communications ETF	iShares
LDRC	iShares® iBonds® 1-5 Year Corporate Ladder ETF	iShares
BGRO	iShares Large Cap Growth Active ETF	iShares
EAOM	iShares ESG Aware 40/60 Moderate Allocation ETF	iShares
CORO	iShares International Country Rotation Active ETF	iShares
IBAT	iShares Energy Storage & Materials ETF	iShares
BPAY	iShares FinTech Active ETF	iShares
IWTR	iShares MSCI Water Management Multisector ETF	iShares
HYGI	iShares Inflation Hedged High Yield Bond ETF	iShares
EFRA	iShares Environmental Infrastructure and Industrials ETF	iShares
LDRI	iShares® iBonds® 1-5 Year TIPS Ladder ETF	iShares
IVEG	iShares Emergent Food and AgTech Multisector ETF	iShares
LDRH	iShares® iBonds® 1-5 Year High Yield and Income Ladder ETF	iShares
ILIT	iShares Lithium Miners and Producers ETF	iShares
IBRN	iShares Neuroscience and Healthcare ETF	iShares
ETEC	iShares Breakthrough Environmental Solutions ETF	iShares
BMED	iShares Health Innovation Active ETF	iShares
IBTQ	iShares® iBonds® Dec 2035 Term Treasury ETF	iShares
IBMT	iShares® iBonds® Dec 2031 Term Muni Bond ETF	iShares
IBGB	iShares® iBonds® Dec 2045 Term Treasury ETF	iShares
IBGL	iShares® iBonds® Dec 2055 Term Treasury ETF	iShares
AGIH	iShares Inflation Hedged U.S. Aggregate Bond ETF	iShares
IBGK	iShares® iBonds® Dec 2054 Term Treasury ETF	iShares
ITDJ	iShares® LifePath® Target Date 2070 ETF	iShares
IBIL	iShares® iBonds® Oct 2035 Term TIPS ETF	iShares
HYBL	SPDR® Blackstone High Income ETF	SPDR
SRLN	SPDR® Blackstone Senior Loan ETF	SPDR
TIPX	SPDR® Bloomberg 1-10 Year TIPS ETF	SPDR
BIL	SPDR® Bloomberg 1-3 Month T-Bill ETF	SPDR
BILS	SPDR® Bloomberg 3-12 Month T-Bill ETF	SPDR
CWB	SPDR® Bloomberg Convertible Securities ETF	SPDR
EBND	SPDR® Bloomberg Emerging Markets Local Bond ETF	SPDR
EMHC	SPDR® Bloomberg Emerging Markets USD Bond ETF	SPDR
CERY	SPDR® Bloomberg Enhanced Roll Yield Commodity Strategy No K-1 ETF	SPDR
JNK	SPDR® Bloomberg High Yield Bond ETF	SPDR
IBND	SPDR® Bloomberg International Corporate Bond ETF	SPDR
BWX	SPDR® Bloomberg International Treasury Bond ETF	SPDR
FLRN	SPDR® Bloomberg Investment Grade Floating Rate ETF	SPDR
SJNK	SPDR® Bloomberg Short Term High Yield Bond ETF	SPDR
BWZ	SPDR® Bloomberg Short Term International Treasury Bond ETF	SPDR
ALLW	SPDR® Bridgewater® All Weather® ETF	SPDR
EMTL	SPDR® DoubleLine® Emerging Markets Fixed Income ETF	SPDR
STOT	SPDR® DoubleLine® Short Duration Total Return Tactical ETF	SPDR
TOTL	SPDR® DoubleLine® Total Return Tactical ETF	SPDR
RWO	SPDR® Dow Jones® Global Real Estate ETF	SPDR
DIA	SPDR® Dow Jones® Industrial Average℠ ETF Trust	SPDR
RWX	SPDR® Dow Jones® International Real Estate ETF	SPDR
RWR	SPDR® Dow Jones® REIT ETF	SPDR
FEZ	SPDR® EURO STOXX 50® ETF	SPDR
XITK	SPDR® FactSet Innovative Technology ETF	SPDR
WIP	SPDR® FTSE International Government Inflation-Protected Bond ETF	SPDR
DECO	SPDR® Galaxy Digital Asset Ecosystem ETF	SPDR
HECO	SPDR® Galaxy Hedged Digital Asset Ecosystem ETF	SPDR
TEKX	SPDR® Galaxy Transformative Tech Accelerators ETF	SPDR
DGT	SPDR® Global Dow ETF	SPDR
GLDM®	SPDR® Gold MiniShares® Trust	SPDR
GLD®	SPDR® Gold Shares	SPDR
PSK	SPDR® ICE Preferred Securities ETF	SPDR
OBND	SPDR® Loomis Sayles Opportunistic Bond ETF	SPDR
LQIG	SPDR® MarketAxess Investment Grade 400 Corporate Bond ETF	SPDR
NZAC	SPDR® MSCI ACWI Climate Paris Aligned ETF	SPDR
CWI	SPDR® MSCI ACWI ex-US ETF	SPDR
EFAX	SPDR® MSCI EAFE Fossil Fuel Reserves Free ETF	SPDR
QEFA	SPDR® MSCI EAFE StrategicFactors℠ ETF	SPDR
EEMX	SPDR® MSCI Emerging Markets Fossil Fuel Reserves Free ETF	SPDR
QEMM	SPDR® MSCI Emerging Markets StrategicFactors℠ ETF	SPDR
NZUS	SPDR® MSCI USA Climate Paris Aligned ETF	SPDR
SHE	SPDR® MSCI USA Gender Diversity ETF	SPDR
QUS	SPDR® MSCI USA StrategicFactors℠ ETF	SPDR
