Symbol	Description	Issuer
IHY	VanEck International High Yield Bond ETF	VanEck
ISRA	VanEck Israel ETF	VanEck
EMLC	VanEck J.P. Morgan EM Local Currency Bond ETF	VanEck
GDXJ	VanEck Junior Gold Miners ETF	VanEck
MLN	VanEck Long Muni ETF	VanEck
SMOG	VanEck Low Carbon Energy ETF	VanEck
OUNZ	VanEck Merk Gold ETF	VanEck
MBBB	VanEck Moody’s Analytics BBB Corporate Bond ETF	VanEck
MIG	VanEck Moody’s Analytics IG Corporate Bond ETF	VanEck
MORT	VanEck Mortgage REIT Income ETF	VanEck
HAP	VanEck Natural Resources ETF	VanEck
DESK	VanEck Office and Commercial REIT ETF	VanEck
CRAK	VanEck Oil Refiners ETF	VanEck
OIH	VanEck Oil Services ETF	VanEck
PPH	VanEck Pharmaceutical ETF	VanEck
PFXF	VanEck Preferred Securities ex Financials ETF	VanEck
REMX	VanEck Rare Earth and Strategic Metals ETF	VanEck
RAAX	VanEck Real Assets ETF	VanEck
RTH	VanEck Retail ETF	VanEck
IBOT	VanEck Robotics ETF	VanEck
RSX	VanEck Russia ETF	VanEck
RSXJ	VanEck Russia Small-Cap ETF	VanEck
SMH	VanEck Semiconductor ETF	VanEck
SHYD	VanEck Short High Yield Muni ETF	VanEck
SMB	VanEck Short Muni ETF	VanEck
SLX	VanEck Steel ETF	VanEck
NLR	VanEck Uranium and Nuclear ETF	VanEck
ESPO	VanEck Video Gaming and eSports ETF	VanEck
VNM	VanEck Vietnam ETF	VanEck